{
  "schema_version": "1.0",
  "ep_id": 117,
  "title": "EP 117: 강북의 IT가 바뀐다: AI 시대의 ERP와 지식 노동 (코스맥스 고종옥 부문장)",
  "published_date": "2026-10-05",
  "hosts": [
    "노정석",
    "고종옥"
  ],
  "category": "AI 사업",
  "source_url": "https://aifrontier.kr/ko/episodes/ep117",
  "raw_path": "06_Artifacts/aifrontier-wiki/raw/ep117/page.html",
  "one_line": "코스맥스의 사내 도메인 전문가들이 AI 코딩으로 자신의 업무를 직접 DX·AX하며 SAP 중심 ERP 생태계의 해자를 흔들고, 70억 원 규모의 솔루션 투자와 유지보수비를 줄인 정량적 성과를 낸 사례를 통해 지식 노동의 미래를 논한다.",
  "key_points": [
    "전 세계 유료 AI 사용자는 인구의 2~3%에 불과하고, 지식 노동자는 약 15억 명, 코더는 약 3천만 명으로 AI 도입은 극초창기다.",
    "코스맥스는 사내 Claude Code 교육을 통해 현업 도메인 전문가 100명 이상이 GitHub에 소스를 커밋하며 자신의 업무 시스템을 직접 만든다.",
    "향후 2~3년간 솔루션 투자 70억 원을 집행하지 않아도 되고, 연간 유지보수비 20억 원의 70% 이상을 절감해 올해만 10억 원을 줄였다.",
    "SAP은 FI/CO 등 회계 모듈의 규칙과 역분개 같은 가드레일로 회계법인의 신뢰를 얻었지만, ABAP 중심의 폐쇄적 생태계가 10년 주기 차세대 ERP 프로젝트의 비용을 키웠다.",
    "실제 업무의 SSOT는 ERP가 아닌 현업 부서의 Excel에 존재하며, AI가 부서 간 커뮤니케이션 비용을 통째로 없애는 변화가 시작됐다.",
    "오픈소스 ERPNext는 테스트에서 70~80%의 가드레일이 동작했지만 한국 세법 미적용과 펌뱅킹 미지원 때문에 아직 국내 도입이 어렵다."
  ],
  "flow": [
    {
      "stage": "도입과 AI 극초창기",
      "summary": "유료 AI 사용자 2~3%, 지식노동자 15억 명, 코더 3천만 명이라는 통계로 AI 도입이 극초창기임을 짚고, 증기기관에서 전기모터로의 전환 비유를 통해 워크플로우 전체가 변해야 진짜 생산성이 온다고 설명한다."
    },
    {
      "stage": "강북의 IT와 ERP 프로젝트 출발",
      "summary": "판교의 IT가 모르는 SAP·Salesforce·Oracle 중심의 강북의 IT를 소개하고, 코스맥스가 2025년 가을 SAP 차세대 프로젝트 판단 미션을 받은 배경과 수백억 원 규모의 프로젝트 현실을 공유한다."
    },
    {
      "stage": "10년 주기 재건축의 문제",
      "summary": "ERP가 10년에 한 번 재건축되며 SI 컨설팅과 개발 비용이 막대하게 들어가는 관행, 기존 백본이 10년간 그대로인 채 고도화 프로젝트만 쌓이는 '아기 몸통에 성인 손발' 비유를 다룬다."
    },
    {
      "stage": "현업의 AI 코딩과 암묵지 디지털화",
      "summary": "사내 Claude Code 교육 후 핵심 업무 담당자들이 부서 시스템을 직접 만들기 시작했고, GitHub에 커밋하는 현업 100명이 넘어서며 Excel에 있던 회사 암묵지가 소프트웨어와 데이터로 전환되는 과정을 설명한다."
    },
    {
      "stage": "SAP 생태계와 AI의 충격",
      "summary": "회계법인이 SAP 데이터만 믿는 이유인 FI/CO 가드레일과 ABAP 생태계의 폐쇄성, SAP 컨설턴트 품귀를 짚고, AI로 인해 고급 소프트웨어 인력이 제조업으로 유입되며 SAP의 해자가 흔들리는 상황을 논한다."
    },
    {
      "stage": "정량 성과와 SSOT 문제",
      "summary": "솔루션 70억 미집행, 유지보수비 70% 절감이라는 재무 성과를 공유하고, SSOT가 ERP 바깥 Excel에 존재하는 이유로 대량 마스터 데이터의 조인 부담과 실시간성 문제를 분석한다."
    },
    {
      "stage": "오픈소스와 조직의 미래",
      "summary": "오픈소스 ERPNext의 가능성과 한국 세법·펌뱅킹의 빈틈, AI가 부서 간 커뮤니케이션 비용을 없애고 영업팀이 고객 접촉에 집중하게 되는 미래 조직의 모습을 전망한다."
    },
    {
      "stage": "AX 인재와 마무리",
      "summary": "자기 업무를 먼저 없애고 무엇을 할지 묻는 AX 인재가 중요하며, 지식 노동자는 AI로 자신의 일을 disrupt하고 통찰을 가져오는 역할로 이동해야 한다는 교훈으로 마무리한다."
    }
  ],
  "body_paragraphs": [
    "노정석은 a16z 팟캐스트에서 얻은 통계를 인용하며 AI 도입이 여전히 극초창기임을 강조한다. 미국 전체 인구의 2~3%만이 유료 AI 요금제를 쓰고, 전 세계 지식 노동자는 약 15억 명, 코더는 약 3천만 명인데, 현재 Codex나 Claude Code 같은 도구의 트래픽 대부분은 코딩에 집중돼 있다. 회사가 직원들에게 200달러짜리 요금제나 무제한 API를 줘도 개인은 빨리 퇴근할 뿐 회사 전체 생산성은 오르지 않는 현상을 지적한다. 그는 이를 증기기관에서 전기모터로 전환되던 시기에 비유한다. 초기에는 큰 증기기관 자리만 큰 전기모터로 바꿨을 때 생산성이 늘지 않았지만, 작은 전기모터가 각 기계에 붙어 공장 구조를 새로 짜기 시작하면서 진짜 생산성이 증가했다는 것이다. 따라서 지식 노동 워크플로우 전체가 통째로 변하지 않으면 변화는 오지 않는다는 주장으로 도입부를 연다.",
    "노정석은 소프트웨어 회사 중심의 '판교의 IT'와 SAP, Salesforce, Oracle, Microsoft 같은 대형 SI 회사들이 주도하는 '강북의 IT'를 구분한다. 코스맥스 역시 강북의 IT가 완전히 들어와 있는 회사로, 2025년 가을 SAP 차세대 프로젝트에 대한 판단을 맡게 됐다. enterprise guy가 아니었던 노정석은 SAP 관련 유튜브 10시간짜리 수업과 ABAP 수업까지 들었지만 10시간을 들어도 무슨 말인지 이해하기 어려웠다고 고백한다. 다만 사업하는 사람 입장에서 ERP가 회사 업무의 백본으로 동작하는지, 돈 대비 결과물이 좋은지를 따져보다 보니, ERP가 재무·HR·총무를 위한 최소한의 시스템에 현업들이 맞춰진 구조라는 느낌을 받았다고 말한다.",
    "고종옥은 ERP 시스템 자체가 재무회계 FI를 지원하기 위해 모든 사람이 데이터를 만들어 주는 구조이며, 업무 프로세스까지 녹이다 보니 시스템이 너무 방대해진다고 설명한다. 가장 큰 문제는 차세대 ERP 프로젝트가 보통 10년 주기로 진행되다 보니, 그동안 바뀐 수많은 업무 프로세스가 빠르게 반영되지 못하고 10년 치 프로세스를 한꺼번에 정비해야 한다는 점이다. 비단 라이선스 비용뿐 아니라 SI 컨설팅과 개발 비용이 막대하게 들어가는 구조가 업계에서 당연하게 여겨지는 게 놀라웠다고 말한다. 코스맥스는 2016년에 구입한 시스템을 10년간 그대로 쓰면서 사업이 확장되고 고객 요구가 복잡해졌지만 백본은 변하지 않아, 고도화 프로젝트들이 별도 게이트웨이를 통해 부가적으로 붙는 형태가 됐다.",
    "고종옥은 10년 주기 재건축을 '아기의 몸통에 성인의 손발을 붙인 형국'이라고 비유한다. 손발만 성인이 되어 기존 업무를 처리하는데 몸통은 아기라서 시스템적으로 많은 문제가 발생하고, ERP는 공장이 멈추지 않도록 항상 살아 있어야 해서 발전이 어렵다는 것이다. 노정석은 기존 레거시, 즉 기술 부채를 건드리지 않고 옆에 묻어 둔 채 새로운 데이터 파이프라인만 구축해 자신들의 솔루션이 돌아가게 만드는 프로젝트 관행을 지적한다. 돌아가는 수천억 원대 시스템을 개선하다 문제가 생기면 안 되고 개선도 되어야 하며, 어느 시점에는 깔끔하게 넘어가야 하는 이 과제가 누가 해도 매우 어렵다고 말한다. 외부 ERP 고수들은 차세대 ERP 프로젝트는 한 서너 번 실패해야 원래라고 조언했다는 일화도 전한다.",
    "AI 도입을 보는 경영진과 현장의 온도차가 크다. 고종옥은 차세대 ERP 프로젝트를 위해서는 AS-IS 분석이 선행되어야 하는데, 빠르게 발전하는 회사일수록 업무 프로세스가 매뉴얼화되지 않고 사수-부사수 관계로 전해지며, 똑똑한 직원은 Excel로 문제를 해결하고 누구는 대충 하는 식으로 산재해 있다고 말한다. IT 컨설팅이 붙어 '내가 싹 정리해 줄게'라며 시작하지만, 해당 업권 특유의 프로세스와 회사만의 좋은 방식은 도메인 전문가가 스스로 정리하는 것이 중요하다. 노정석은 회사가 마켓 리더로 떠오르며 만들어 온 고유의 시스템, 즉 회사의 암묵지가 ERP가 아닌 가장 똘똘한 직원의 PC에 있는 Excel이나 문서·파워포인트 위에 존재한다고 지적한다. 조직은 그 Excel 위에서 굴러가고, Excel에서 정리된 결론만 ERP로 넘겨 처리하는 '적응' 구조가 만들어져 왔다.",
    "2025년 가을, 코스맥스는 사내 지원자를 대상으로 Claude Code 교육을 실시했다. 당시 Codex보다 인기가 없던 시점이었지만, 핵심 업무를 담당하던 앞서가는 직원들이 대거 지원했다. 고종옥은 각 부서에 꼭 필요한 시스템을 스스로 만들어 쓰기 시작했고, 복잡한 시스템을 제외하고는 SI 프로젝트 발주나 솔루션 구매 대신 내부 제작 분위기가 형성됐다고 설명한다. 도메인 전문가라고 부르는 기존 업무 담당자들 중 개발자급으로 GitHub에 소스를 커밋하는 사람이 산하에만 100명이 넘는다. 이들은 대부분 비엔지니어 출신으로 올해나 작년에 처음 개발을 해본 사람들이다. Excel이 현업들이 직접 개발한 소프트웨어로 바뀌면서, 저장된 중간 계산 데이터가 ERP에 100% 남지 않던 한계를 넘어 업무 프로세스 과정 전체가 사내 데이터로 남기 시작했다. 제조업의 덜 된 DX 부분을 혁신가들이 AX를 하다 보니 필요한 DX까지 마무리되는 형태가 되고 있다.",
    "SAP 데이터만 믿을 수 있다는 회계법인의 신뢰는 가드레일이 잘 잡혀 있기 때문이다. 고종옥은 자체 ERP에서 SQL문으로 데이터를 고칠 수 있는 것과 달리, SAP은 FI와 관리회계 CO, 영업·매출 SD 모듈의 흐름에서 생성된 데이터가 규칙에 의해서만 쓰이고 수정된다고 설명한다. 월 마감 후 원가 수정이 필요하면 바로 수정하는 게 아니라 역분개라는 과정을 통해 기존 거래를 되돌리고, 데이터베이스 트랜잭션처럼 업무 간에도 트랜잭션으로 묶여 있는 것들이 많다. 이런 역사 덕분에 회계 시장에서 강한 신뢰를 얻는다. 반면 ABAP이라는 언어로 커스터마이징해야 하는 폐쇄성은 문제다. 컴퓨터공학과 출신인 고종옥도 ABAP 코드를 한 번도 써본 적이 없고, ABAPer들은 다른 언어를 모르는 경우가 많아 서로 모듈 간 경계를 넘지 않는 독특한 생태계를 형성하고 있다.",
    "SAP은 40~50년 동안 해자로 둘러싸인 강력한 사업을 만들어 왔다. 솔루션만 공급하고 직접 팔지 않으며, 항상 제3자 컨설팅 회사를 끼고 팔아 이들의 이익률을 보장해 주고, 공인 자격증을 발급하며 생태계 규칙을 설정했다. 전통적으로 실력 있는 소프트웨어 엔지니어들은 스타트업이나 빅테크로 갔기 때문에 제조업은 고급 인력을 구할 수 없었고, 그 공백을 SAP·Salesforce·IBM 같은 대형 B2B 회사들이 메웠다. 하지만 AI 시대가 오면서 소프트웨어 엔지니어 채용이 전면 동결되고 고급 인력이 시장에 공급되기 시작하자, 제조업도 그동안 채용하지 못했던 인재를 채용할 수 있게 됐다. 고종옥은 AX 혁신팀에서 10명 이상 채용을 준비하며 이력서 100장 가까이 검토했는데 이력이 정말 좋아졌다고 말한다. vibe coder의 사고(DB 날려 먹기 등)도 있지만 회사 전체적으로 예전에 할 수 없었던 일을 하고 있다.",
    "7~8개월 열심히 뛴 결과, 코스맥스는 향후 2~3년 동안 도입해야 했던 솔루션 70억 원어치를 사지 않아도 되게 됐다. 연간 유지보수비 20억 원 중 70% 이상을 내년부터 절감하고, 올해만 당장 10억 원을 줄였다. 노정석은 AI가 디플레이션을 일으키는 힘이라고 평가하고, 고종옥은 예전에는 대기업이 솔루션을 사주며 낙수효과로 소프트웨어 회사가 성장했다면, 지금은 소프트웨어 인력이 큰 회사에 직접 합류해 핵심 경쟁력이 강화되는 효과가 나타난다고 본다. 이는 K-뷰티 경쟁력 제고로 이어질 수 있다는 것이다. 한편 SSOT, 즉 단일한 진실의 원천이 ERP에 있어야 하는데 실제로는 ERP 바깥 Excel에 있는 경우가 많다. 코스맥스는 자재 마스터가 몇십만 건에서 몇백만 건에 달하고 서로 연결되어 있어 실시간 계산이 어렵고, 배치가 7~8시간씩 돌아가는 경우도 있다. 최종 생산품이 수만 가지인 코스맥스에 맞게 설계되지 않은 무거운 ERP는 Just-in-Time 실시간성을 반영하기 어렵다.",
    "AI가 들어오면서 부서 간 커뮤니케이션 비용이 통째로 없어지는 변화가 일어나고 있다. 고종옥은 특정 부서의 한 분이 하루에 처리해야 할 Teams 메시지가 300건씩 왔는데 이런 것들이 없어지거나 통째로 사라진 일들이 있다고 말한다. 모두가 동시에 보는 하나의 동기화된 데이터베이스가 있으면 해결되는 문제들이 어마어마하게 많았다는 것이다. 노정석은 사람들이 대부분 합리적이고 기회가 있으면 공급이 생긴다며, 엔터프라이즈 B2B도 AI 때문에 기존 생태계에 대격변이 있을 수밖에 없다고 전망한다. 고종옥은 오픈소스 ERPNext를 테스트해 본 결과, AS-IS 분석의 업무 프로세스 가드레일이 완벽하지는 않아도 70~80% 동작하는 것을 보고 깜짝 놀랐다고 한다. 다만 한국 세법에 맞게 적용되지 않은 점과 펌뱅킹 미지원이라는 두 가지가 도입 장벽이며, 스타트업이 이 빈틈을 메우면 가벼운 ERP SaaS가 빠르게 등장할 가능성이 있다.",
    "AI가 재편하는 기업 조직의 미래에 대해 고종옥은 영업팀을 예로 든다. 국내 마케팅 담당자는 고객 대응부터 품질·생산·자재·부자재·연구소까지 모든 백엔드를 전화로 연결하는 일이 너무 많다. 매출이 급격히 성장하고 고객사가 늘어나는 환경에서 제한된 인력으로 복잡도가 계속 늘어나기 때문에, 이런 업무는 장기적으로 대부분 AI로 대체될 것이라고 본다. 그러면 담당자는 고객과의 접촉, 새로운 고객 발굴, 고객의 고민을 같이 해결하는 일에 더 집중하게 된다. 조직 변화 속도에 대해 그는 굉장히 보수적으로 봐도 2년 안에는 완전히 바뀔 것 같다고 말하며, 특정 부분은 6개월 단위로 확확 바뀌는 모습이 될 것이라고 전망한다. 마치 사이버펑크처럼 손이 강화되고 눈이 강화되고 다리가 강화되듯 영업, 공장, 연구소가 순차적으로 바뀌다가 결국 다 바뀐다는 것이다.",
    "마지막으로 AX 인재의 조건을 논한다. 고종옥은 자신의 업무를 루틴하게 잘 처리하는 것에 한정하면 위험할 수 있고, domain knowledge를 바탕으로 계속 개선하며 더 많은 일을 비슷한 노동 시간으로 해내는 사람이 되어야 한다고 말한다. AI로 8시간 걸리던 일이 5시간이 됐으니 3시간 놀아야지 하는 사람은 대체될 가능성이 크다. 노정석은 코스맥스에서도 AX를 하시는 분들이 자신의 업무를 제일 먼저 없애버리고 더 하겠다고 한 분들이라고 강조한다. 또한 SI 회사들이 어려워지는 이유는 AI 혁신으로 얻은 효율 향상을 이익률 증가로만 가져가고 가격을 낮추지 않아, 내부에서 만드는 것과 차이가 크게 나기 때문이다. 노정석은 지식 노동자 입장에서 교훈을 정리한다. \"내가 내 일을 빨리 AI로 disrupt해버리고, 이 일은 난 안 해야 되는 거구나. 그럼 나는 무슨 일을 해야 하지?\"라는 질문을 누가 더 빨리, 더 열심히, 더 잘하느냐의 게임이다."
  ],
  "entities": [
    {
      "id": "sap",
      "label": "SAP",
      "type": "concept",
      "aliases": [
        "SAP",
        "SAP 시스템",
        "SAP 생태계",
        "SAP 프로젝트"
      ]
    },
    {
      "id": "abap",
      "label": "ABAP",
      "type": "concept",
      "aliases": [
        "ABAP",
        "ABAP 코드",
        "ABAPer"
      ]
    },
    {
      "id": "erpnext",
      "label": "ERPNext",
      "type": "concept",
      "aliases": [
        "ERPNext"
      ]
    },
    {
      "id": "ssot",
      "label": "SSOT",
      "type": "concept",
      "aliases": [
        "SSOT",
        "단일 진실의 원천",
        "single source of truth"
      ]
    },
    {
      "id": "claude-code",
      "label": "Claude Code",
      "type": "model",
      "aliases": [
        "Claude Code",
        "Claude Code 교육"
      ]
    },
    {
      "id": "dx",
      "label": "DX",
      "type": "concept",
      "aliases": [
        "DX",
        "디지털 트랜스포메이션"
      ]
    },
    {
      "id": "ax",
      "label": "AX",
      "type": "concept",
      "aliases": [
        "AX",
        "AI 트랜스포메이션"
      ]
    },
    {
      "id": "ko-jong-ok",
      "label": "고종옥",
      "type": "person",
      "aliases": [
        "고종옥",
        "고 부문장"
      ]
    },
    {
      "id": "noh-jung-seok",
      "label": "노정석",
      "type": "person",
      "aliases": [
        "노정석",
        "노 대표"
      ]
    }
  ],
  "notable_quote": {
    "text": "잡일 없애줄 테니까 통찰을 가져와",
    "speaker": "노정석"
  },
  "language": "ko",
  "extractor": "deepseek-pro",
  "extracted_at": "2026-10-05",
  "review_status": "draft"
}
