{
  "schema_version": "1.0",
  "ep_id": 97,
  "slug": "ai-psychosis-people",
  "title": "AI Psychosis 시대의 사람들",
  "published_date": "2026-05-21",
  "hosts": [
    "노정석",
    "최승준"
  ],
  "category": "에이전트",
  "source_url": "https://aifrontier.kr/ko/episodes/ep97",
  "raw_path": "06_Artifacts/aifrontier-wiki/raw/ep97/page.html",
  "one_line": "Claude Code와 Codex가 지식노동의 기본 표면이 되면서, 기회는 AI native한 문제 해결로 이동하지만 사람에게는 번아웃·학습 약화·혼돈 관리라는 새 병목이 남는다.",
  "key_points": [
    "Claude Code와 Codex의 하네스 경쟁은 코딩을 넘어 모든 지식노동 워크플로로 확산되고 있다.",
    "소프트웨어 제작의 특권이 약해지면서 새 AI 애플리케이션은 UX가 아니라 task completion을 파는 하네스와 컨트롤 레이어가 된다.",
    "버티컬 차별화의 핵심은 ChatGPT나 Codex가 쉽게 가져갈 수 없는 고객 데이터와 툴 조합이다.",
    "AI Native와 AI Assisted를 구분하지 못하면 기존 조직의 AI 도입은 생산성 개선 없이 컨설팅 프로젝트로 끝날 수 있다.",
    "AI talent의 기준은 도구 사용법을 넘어 모델·컴퓨트·추론 인프라·도메인 문제를 함께 읽는 능력으로 올라간다.",
    "AI psychosis와 slow AI 논의는 빠른 오케스트레이션 능력과 인간의 학습·건강 사이의 긴장을 드러낸다."
  ],
  "flow": [
    {
      "stage": "오프닝",
      "summary": "Google I/O와 모델 출시 주기, 하네스 경쟁의 가속을 배경으로 잡는다."
    },
    {
      "stage": "슈퍼 앱화",
      "summary": "Claude Code와 Codex가 코딩 도구를 넘어 지식노동의 범용 워크플로가 되는 흐름을 짚는다."
    },
    {
      "stage": "AI 애플리케이션",
      "summary": "소프트웨어 제작 특권의 약화와 AI surface, task completion 중심 앱의 미래를 논의한다."
    },
    {
      "stage": "버티컬 전략",
      "summary": "고객 데이터와 툴 조합이 Codex·ChatGPT와 싸우는 버티컬의 차별화 축이 된다."
    },
    {
      "stage": "인재상",
      "summary": "AI Native와 AI Assisted를 구분하고, AI talent의 기준이 도구 사용을 넘어서는 이유를 설명한다."
    },
    {
      "stage": "인프라",
      "summary": "Lablup급 오케스트레이션과 inference 구조, control layer가 새 애플리케이션의 밑동이 된다."
    },
    {
      "stage": "심리와 학습",
      "summary": "AI psychosis, 도파민 슬롯머신, Cat Wu의 혼돈 인재상, Dwarkesh의 학습법을 연결한다."
    },
    {
      "stage": "마무리",
      "summary": "slow AI와 mind-sized bites, 브랜드·디스트리뷰션의 중요성, 100회 준비로 닫는다."
    }
  ],
  "body_paragraphs": [
    "이번 회차는 준비된 한 가지 논문을 파고드는 대신, 2026년 봄의 AI 현장을 둘러싼 만담형 정리다. 출발점은 Claude Code와 Codex가 더 이상 엔지니어 전용 코딩 도구가 아니라는 감각이다. 노정석은 모든 지식 노동자 계층에 이 프랙티스가 스며들고 있고, 모델이 발전하면 하네스가 발전하고 그 특징이 다시 모델 안으로 들어가는 선순환이 숨 막히는 속도로 진행된다고 본다.",
    "모델 경쟁의 배경에는 GPT-5.6, Claude Mythos, Gemini 3.5 Flash, Veo 4 같은 이름들이 놓인다. 하지만 논의의 초점은 단순 성능표가 아니라 컴퓨테이션과 추론 병목이다. DeepSeek V4가 Huawei Ascend를 언급한 것처럼 탈 NVIDIA 생태계와 전용 인퍼런스 칩이 늘어나고, 최승준은 T_compute와 T_mem에 이어 사람의 사고 시간이 병목이 되는 T_brain을 떠올린다.",
    "Claude Code와 Codex의 정책·제품 변화는 상반기 AI 코딩 붐의 핵심이다. Claude Code는 AI 코딩 입문의 대명사였지만 Anthropic의 컴퓨트 제약과 요금 정책 변화가 보이고, Codex는 데스크톱 앱과 CLI를 빠르게 개선하며 따라붙는다. OpenAI가 Codex를 슈퍼 앱처럼 부르는 이유도 여기에 있다. general한 능력, 툴, context 관리가 붙으면 코딩뿐 아니라 거의 모든 워크플로를 처리할 수 있기 때문이다.",
    "이 과정은 엔지니어에게 번아웃을 만든다. 배휘동의 120x 경험처럼 사내 개밥 먹기 수준에서 생산 파이프라인과 실험 속도는 폭발적으로 빨라졌지만, agent가 오래 돌아도 중요한 조율과 의사결정은 사람이 해야 한다. 일을 줄이기보다 더 많이 처리하고 싶게 만드는 도파민 슬롯머신이 되어, 밥을 먹으면서도 SSH나 모바일로 에이전트에게 일을 주는 풍경이 생긴다.",
    "소프트웨어 제작의 특권도 약해진다. 예전에는 소프트웨어를 만들 수 있다는 것 자체가 창업과 사업 확장의 큰 병목이었고, 투자금의 상당 부분이 엔지니어링·프로덕트 인건비로 들어갔다. 이제 Claude Code나 Codex로 누구나 프로덕트와 유틸리티를 만들 수 있게 되면서, GitHub에 올라온 새 프로젝트의 가치는 '써봐야 할 물건'보다 '어떤 차별화된 엣지가 있는가'로 줄어든다.",
    "그래서 AI 애플리케이션의 미래는 모바일 앱을 더 빨리 만드는 것이 아니라 task completion을 파는 형태로 이동한다. 사용자는 UX 안에서 스스로 문제를 해결하는 대신 intent를 주고, 사업자는 문제 해결 자체를 상품으로 제공한다. 이때 AI surface는 대화창, 보이스, 혹은 Jony Ive식 새 하드웨어가 될 수 있지만, 애플리케이션의 80~90%는 사용자가 보지 않는 하네스다.",
    "버티컬 사업의 차별화도 같은 공식으로 설명된다. Codex나 ChatGPT가 general한 슈퍼 앱으로 들어오면 쿠팡이나 카카오 같은 기존 사업자는 자기 데이터와 툴을 어떻게 지킬지 고민해야 한다. 노정석은 버티컬의 새 가치를 고객에 대해 배타적으로 가진 데이터와, 그 회사만 가진 툴 조합의 곱으로 본다. 이 하네스는 곧 control layer이고, 사용자의 intent를 특정 도메인의 문제 해결로 연결하는 장치다.",
    "새 회사의 플레이북도 바뀐다. 기존 모바일 앱이나 웹 서비스를 딸깍딸깍 복제하는 것은 딥러닝의 MNIST처럼 연습 문제가 된다. 의미 있는 회사는 Codex와 비교해 더 깊은 고객 데이터, 더 좋은 툴 셋, 더 깔끔한 조합으로 특정 버티컬 문제를 풀어야 한다. 바이올로지, 재료공학, 화학, 물리 같은 사이언스 영역에서도 같은 구조의 AI 애플리케이션이 열릴 수 있다.",
    "기존 기업의 AI 도입에서는 AI Native와 AI Assisted의 구분이 중요하다. AI Native는 사람 개입이 거의 없이 워크플로가 끝나는 상태이고, AI Assisted는 사람이 하던 일을 조금 편하게 만드는 수준이다. 많은 회사가 AI 네이티브를 말하지만 실제로는 노가다 몇 개를 바꾸는 AI Assisted에 머물고, 구성원은 자기 존재감이 사라질까 봐 도구를 쓰지 않아 생산성 개선이 일어나지 않는다.",
    "그래서 AI talent의 기준은 Claude Code나 Codex를 쓸 줄 아는 것만으로는 부족해진다. 모델과 컴퓨트 경쟁이 어디로 흐르는지, 무엇이 핵심 lever인지, inference cloud와 workload별 prefill/decode 구조가 왜 중요한지를 읽어야 한다. Lablup급 오케스트레이션 인프라, vLLM·SGLang 너머의 하드웨어·툴 운영, 그리고 그 위의 control layer를 함께 이해해야 특정 비즈니스의 타이밍을 맞출 수 있다.",
    "인재상은 두 갈래로 나뉜다. 하나는 변호사, investment banking, 신약 개발처럼 도메인 지식이 깊고 어떤 문제를 풀어야 하는지 아는 사람이 AI를 견인하는 경우다. 다른 하나는 OMX를 만들며 B2C/B2B 실험을 빠르게 돌리는 젊은 빌더들처럼, 목표 자체도 meta optimization하고 delegation하면서 찾아가는 사람들이다. 둘 다 AI를 많이 쓰는 것은 필요조건이지만 충분조건은 아니다.",
    "회차 제목의 AI psychosis는 이 속도가 사람에게 남기는 심리적 흔들림을 가리킨다. Karpathy가 언급한 흐름과 이어지지만, 여기서의 AI psychosis는 에이전트가 슬롯머신처럼 보상을 주고, 투두 리스트에 적는 것만으로 이미 AI가 해줄 것 같은 착각을 만들며, 과몰입과 피로를 동시에 부르는 상태에 가깝다. Cat Wu가 말한 혼돈을 즐길 인재상은 매력적이지만, 그만큼 thinking token을 계속 써야 한다는 부담도 따른다.",
    "Mitchell Hashimoto와 Mario Zechner의 경고는 이 질주에 브레이크를 건다. 테스트가 통과하면 괜찮다는 믿음 아래 실제 아키텍처가 망가지는 일을 걱정하는 목소리다. 노정석은 이제 많은 문제를 compute로 환원해 Ralph를 여러 번 돌려 맞으면 버튼을 누르는 단계까지 왔다고 말하지만, 최승준은 그런 속도 뒤에 유지보수 불가능성과 학습 기회 상실이 남는다고 본다.",
    "마지막 균형추는 Dwarkesh와 slow AI다. Dwarkesh는 AI를 잘 쓰는 동시에 flashcard와 칠판 세션, demanding artifact를 통해 자기 생각에 부하를 걸고 역량을 끌어올린다. 반대로 slow AI와 mind-sized bites는 AI의 페이스에 휩쓸리지 말고 마음이 소화할 수 있는 크기로 배우자는 제안이다. 빠르게 오케스트레이션하는 능력이 보상받는 시대에도, 인간의 학습과 건강을 어떻게 지킬지는 여전히 열린 문제로 남는다."
  ],
  "entities": [
    {
      "id": "claude-code",
      "label": "Claude Code",
      "type": "model",
      "aliases": [
        "Claude Code"
      ]
    },
    {
      "id": "codex",
      "label": "Codex",
      "type": "concept",
      "aliases": [
        "Codex"
      ]
    },
    {
      "id": "t-brain",
      "label": "T_brain",
      "type": "concept",
      "aliases": [
        "T_brain"
      ]
    },
    {
      "id": "ai-surface",
      "label": "AI surface",
      "type": "concept",
      "aliases": [
        "AI surface"
      ]
    },
    {
      "id": "control-layer",
      "label": "control layer",
      "type": "concept",
      "aliases": [
        "control layer"
      ]
    },
    {
      "id": "ai-native",
      "label": "AI Native",
      "type": "concept",
      "aliases": [
        "AI Native",
        "AI 네이티브"
      ]
    },
    {
      "id": "ai-assisted",
      "label": "AI Assisted",
      "type": "concept",
      "aliases": [
        "AI Assisted"
      ]
    },
    {
      "id": "ai-talent",
      "label": "AI talent",
      "type": "concept",
      "aliases": [
        "AI talent"
      ]
    },
    {
      "id": "lablup",
      "label": "Lablup",
      "type": "concept",
      "aliases": [
        "Lablup"
      ]
    },
    {
      "id": "omx",
      "label": "OMX",
      "type": "concept",
      "aliases": [
        "OMX"
      ]
    },
    {
      "id": "ai-psychosis",
      "label": "AI psychosis",
      "type": "concept",
      "aliases": [
        "AI psychosis"
      ]
    },
    {
      "id": "cat-wu",
      "label": "Cat Wu",
      "type": "person",
      "aliases": [
        "Cat Wu"
      ]
    },
    {
      "id": "dwarkesh",
      "label": "Dwarkesh",
      "type": "person",
      "aliases": [
        "Dwarkesh"
      ]
    },
    {
      "id": "slow-ai",
      "label": "slow AI",
      "type": "concept",
      "aliases": [
        "slow AI"
      ]
    },
    {
      "id": "mind-sized-bites",
      "label": "mind-sized bites",
      "type": "concept",
      "aliases": [
        "mind-sized bites"
      ]
    }
  ],
  "notable_quote": {
    "text": "AI 네이티브와 AI 어시스티드를 구분해야 된다는 거예요.",
    "speaker": "노정석"
  },
  "language": "ko",
  "extractor": "deepseek-pro",
  "extracted_at": "2026-07-03",
  "review_status": "draft"
}
